url,name,address,city,state,phone
https://www.portwilliamsdentist.com/,SeaPort Dental,"963 NS-358, Port Williams, NS B0P 1T0, Canada",NS B0P 1T0,Canada,+1 902-697-3000
http://www.themarmalademotel.com/,The Marmalade Motel,"25658 Nova Scotia Trunk 7, Port Dufferin, NS B0J 2R0, Canada",NS B0J 2R0,Canada,+1 782-285-0095
https://sheetharbourdental.com/,Sheet Harbour Dental Centre,"22709 Nova Scotia Trunk 7, Sheet Harbour, NS B0J 3B0, Canada",NS B0J 3B0,Canada,+1 902-885-2535
http://porterslakedental.com/,Results,"5141 Nova Scotia Trunk 7, Porters Lake, NS B3E 1M1, Canada",NS B3E 1M1,Canada,+1 902-827-4746
https://www.porthawkesburydental.com/site/home?utm_source=G&utm_medium=LPM&utm_campaign=DentalCorp,Results,"308 Philpott St, Port Hawkesbury, NS B9A 2B8, Canada",NS B9A 2B8,Canada,+1 782-825-5464
https://porterslakefamilysmiles.com/,Results,"61 Stella Dr, Porters Lake, NS B3E 0G4, Canada",NS B3E 0G4,Canada,+1 902-827-5555
http://transcendentalgroup.ca/,Results,"7772 Nova Scotia Trunk 7, Musquodoboit Harbour, NS B0J 2L0, Canada",NS B0J 2L0,Canada,+1 902-889-3592
https://www.nancykennedydentistry.ca/meet-our-team,Results,"190 Victoria Rd Ext, Dartmouth, NS B3A 1W2, Canada",NS B3A 1W2,Canada,+1 902-464-4444
